{
  "version": 1,
  "generatedBy": "claude (re-themed)",
  "app": {
    "name": "SubTrack",
    "tagline": "Never pay for a forgotten renewal"
  },
  "theme": {
    "preset": "aurora-light",
    "colors": {
      "accent": "#5B4FE0",
      "accent2": "#C057E8"
    },
    "fonts": {
      "headline": "Plus Jakarta Sans",
      "headlineWeight": 800
    },
    "device": {
      "frame": "dark",
      "shadow": "soft"
    }
  },
  "slides": [
    {
      "id": "hero",
      "role": "hero",
      "layout": "hero",
      "screenshots": [
        "01-dashboard.png"
      ],
      "eyebrow": "SUBSCRIPTION TRACKER",
      "headline": "Know your real monthly burn",
      "highlight": "monthly burn",
      "subline": "Every subscription and currency, added up into one honest number"
    },
    {
      "id": "renewals",
      "role": "differentiator",
      "layout": "device-bottom",
      "screenshots": [
        "02-subscriptions.png"
      ],
      "eyebrow": "RENEWALS",
      "headline": "No more forgotten renewals",
      "highlight": "forgotten",
      "subline": "Days-to-renewal on every service, free trials kept apart"
    },
    {
      "id": "calendar",
      "role": "feature",
      "layout": "device-top",
      "screenshots": [
        "06-calendar.png"
      ],
      "eyebrow": "CALENDAR",
      "headline": "See every charge coming",
      "highlight": "coming",
      "subline": "A dot on each renewal day, tap to see what's due"
    },
    {
      "id": "analytics",
      "role": "feature",
      "layout": "callouts",
      "screenshots": [
        "05-analytics.png"
      ],
      "eyebrow": "INSIGHTS",
      "headline": "Watch the year add up",
      "highlight": "year",
      "subline": "Monthly, quarterly and yearly totals with smart insights",
      "callouts": [
        "Yearly projection",
        "Cost per day",
        "Your priciest service"
      ]
    },
    {
      "id": "add-and-detail",
      "role": "feature",
      "layout": "two-devices",
      "screenshots": [
        "03-add-subscription.png",
        "04-detail.png"
      ],
      "eyebrow": "ANY CADENCE",
      "headline": "Add a plan, see its true cost",
      "highlight": "true cost",
      "subline": "Weekly to every 6 months in, yearly total and daily average out"
    },
    {
      "id": "currency-private",
      "role": "proof",
      "layout": "two-devices",
      "screenshots": [
        "08-onboarding.png",
        "07-settings.png"
      ],
      "eyebrow": "OFFLINE FIRST",
      "headline": "Any currency. No account.",
      "highlight": "No account.",
      "subline": "Pick from 51 currencies, everything stays on your phone"
    },
    {
      "id": "closer",
      "role": "closer",
      "layout": "closer",
      "screenshots": [
        "01-dashboard.png"
      ],
      "headline": "Finally, no surprise renewals",
      "highlight": "no surprise",
      "subline": "No subscription needed to track your subscriptions",
      "badges": [
        "No account",
        "Works offline",
        "Any currency"
      ]
    }
  ],
  "featureGraphic": {
    "layout": "fg-fan",
    "headline": "Never miss a renewal again",
    "highlight": "renewal",
    "screenshots": [
      "01-dashboard.png",
      "02-subscriptions.png",
      "06-calendar.png"
    ]
  }
}